{
  "schemaVersion": 1,
  "objectType": "product_company",
  "targetName": "Aegis Sovereign AI (illustrative)",
  "context": "Synthetic example. Demonstrates that the instrument can CLASSIFY: survivability proof substituting for operating proof reads C / Circular without any claim of wrongdoing.",
  "sources": [
    { "id": "s1", "title": "Series C announcement press release", "publisher": "Company newsroom", "url": "https://example.org/aegis-seriesc", "date": "2025-02-01" },
    { "id": "s2", "title": "Valuation reported in trade press", "publisher": "Venture trade press", "url": "https://example.org/aegis-valuation", "date": "2025-02-03" },
    { "id": "s3", "title": "Industry ranking award listing", "publisher": "Conference run by lead investor's foundation", "url": "https://example.org/aegis-ranking", "date": "2024-12-10" },
    { "id": "s4", "title": "Cap-table summary from filings", "publisher": "State registry", "url": "https://example.org/aegis-captable", "date": "2025-01-15" },
    { "id": "s5", "title": "Board composition disclosure", "publisher": "Company governance page", "url": "https://example.org/aegis-board", "date": "2025-01-20" }
  ],
  "claims": [
    { "id": "c1", "field": "capital_raised", "statement": "$220M raised across three rounds.", "evidenceClass": "confirmed", "confidence": 0.9, "sourceIds": ["s1", "s4"] },
    { "id": "c2", "field": "valuation", "statement": "Reported $3.1B valuation.", "evidenceClass": "reported", "confidence": 0.6, "sourceIds": ["s2"] },
    { "id": "c3", "field": "competed_awards", "statement": "No disclosed competed program of record; one sole-source micro-pilot referenced.", "evidenceClass": "open", "confidence": 0.3, "sourceIds": [] },
    { "id": "c4", "field": "ownership_posture", "statement": "Private layer retains the model, semantics, and operating workflows.", "evidenceClass": "reported", "confidence": 0.7, "sourceIds": ["s5"] },
    { "id": "c5", "field": "independent_verification", "statement": "Cited legitimacy is a ranking sponsored by the lead investor's foundation.", "evidenceClass": "derived", "confidence": 0.7, "sourceIds": ["s3", "s4"] },
    { "id": "c6", "field": "production_status", "statement": "Leads with deployments language; no performance data against a baseline.", "evidenceClass": "reported", "confidence": 0.6, "sourceIds": ["s1"] }
  ],
  "seams": [
    { "id": "capital_to_contract_gap", "state": "triggered", "reason": "Valuation and raise dwarf any disclosed competed award. The gap is the story.", "sourceIds": ["s1", "s2"] },
    { "id": "tense_of_proof", "state": "triggered", "reason": "Contracts framed as coming; details withheld.", "sourceIds": ["s1"] },
    { "id": "metric_substitution", "state": "triggered", "reason": "Leads with raises and investor names, not performance.", "sourceIds": ["s1"] },
    { "id": "self_referential_legitimacy", "state": "triggered", "reason": "Ranking graded and sponsored by the capital side.", "sourceIds": ["s3", "s4"] },
    { "id": "independent_customer", "state": "unclear", "reason": "Only a sole-source micro-pilot referenced; no competed program of record sourced.", "sourceIds": [] },
    { "id": "removal_test_capability", "state": "triggered", "reason": "Remove the capital narrative and press; little independently survives in the record.", "sourceIds": ["s1", "s3"] },
    { "id": "ownership_of_seams", "state": "triggered", "reason": "Private layer keeps the model and semantics; nothing reproducible survives removal.", "sourceIds": ["s5"] }
  ],
  "contamination": {
    "bucket": "circular",
    "components": [
      { "key": "cap_table_circularity", "present": true, "reason": "Recurring consortium and its vehicles supply most of the capital.", "sourceIds": ["s4"] },
      { "key": "validator_circularity", "present": true, "reason": "Cited ranking is funded and graded by the lead investor's foundation.", "sourceIds": ["s3", "s4"] },
      { "key": "independent_demand_inverse", "present": true, "reason": "Competed external demand is thin against $220M cumulative capital.", "sourceIds": ["s1"] },
      { "key": "cross_holding_density", "present": true, "reason": "Backers, board, and validator recur across each other.", "sourceIds": ["s4", "s5"] }
    ]
  },
  "verdictNotes": {
    "state": "C_costume_or_proof_substitution",
    "loop": "open",
    "rationale": "Survivability proof (capital, valuation, a sponsored ranking) stands in for operating proof. No competed program of record and no independently verified performance against a baseline. This is a structural read, not an allegation of wrongdoing.",
    "largestGap": "$220M cumulative capital against zero disclosed competed awards.",
    "tenseOfProof": "Future — 'deploying soon', details withheld.",
    "whatWouldClearIt": "A named, dated, competed program of record with independently verified performance against a stated baseline would move this toward A.",
    "rootsBeliefSupplier": "Lead investor's foundation and the recurring consortium.",
    "rootsValueRetainer": "Private operating layer retains the model, semantics, and exit rights.",
    "nextPulls": ["Competed contract docket, if any", "Independent baseline test results", "Full cap-table with outside-capital share"]
  }
}
